{
  "id": "transition-unsupported-version",
  "kind": "parsed-value",
  "description": "U2 unsupported input (PLAN:378; AE5 PLAN:130): a marker with an unsupported version is present; the reader does not interpret it as registration authority; inspection reports occupied-invalid and no write occurs. Outcome: occupied-invalid.",
  "payload": {
    "version": 2,
    "identity": "99999999-aaaa-4bbb-8ccc-dddddddddddd",
    "label": "Future Marker",
    "kind": "direct",
    "workspace": ".",
    "record_sources": [
      {
        "type": "sharepoint/team-site",
        "uri": "https://sharepoint.example.org/sites/future-marker"
      }
    ]
  },
  "inputs": {
    "scenario": "inspect",
    "observed": {
      "workspace_identity": "ws-identity-15",
      "parent": {
        "identity": "parent-identity-15"
      },
      "marker": "unsupported",
      "marker_identity": "99999999-aaaa-4bbb-8ccc-dddddddddddd"
    },
    "draft": null,
    "confirmation": "absent",
    "lock": "absent",
    "projection": "none",
    "twist": "none"
  }
}
