{
  "id": "boundary-label-256-bytes",
  "kind": "parsed-value",
  "description": "Boundary-valid (PLAN:364): label at the 256-byte cap (256 ASCII chars, maxLength 256).",
  "payload": {
    "version": 1,
    "identity": "f47ac10b-58cc-4372-a567-0e02b2c3d479",
    "label": "aaaaaaaaaaaaaaaaaaaaaaaaaaaaaaaaaaaaaaaaaaaaaaaaaaaaaaaaaaaaaaaaaaaaaaaaaaaaaaaaaaaaaaaaaaaaaaaaaaaaaaaaaaaaaaaaaaaaaaaaaaaaaaaaaaaaaaaaaaaaaaaaaaaaaaaaaaaaaaaaaaaaaaaaaaaaaaaaaaaaaaaaaaaaaaaaaaaaaaaaaaaaaaaaaaaaaaaaaaaaaaaaaaaaaaaaaaaaaaaaaaaaaaaaaaaaaaaa",
    "kind": "direct",
    "workspace": ".",
    "record_sources": [
      {
        "type": "example/records",
        "uri": "https://records.example.invalid/label-boundary"
      }
    ]
  }
}
